{
  "schema_version": "1.0.0",
  "snapshot_id": "sha256:798f2b62fe4b048789a9d3f51ee3099b49300dfb87e9d448bedb7b4bc81ab51e",
  "source": "synthetic",
  "catalog_format": "deriv_active_symbols",
  "catalog_normalizer_version": "1.0.0",
  "connector_version": "fixture-v1",
  "source_schema_release": "synthetic-v1",
  "source_schema_sha256": "1111111111111111111111111111111111111111111111111111111111111111",
  "observation_id": "019b76da-a800-7000-8000-000000000001",
  "raw_payload_sha256": "2222222222222222222222222222222222222222222222222222222222222222",
  "received_at_utc": "2026-01-01T00:00:00.100Z",
  "entry_count": 3,
  "content_sha256": "61998c161db0da302eb8cc7ecc7b758b1893307fbff3a113cb0d2886901f9a00",
  "entries": [
    {
      "underlying_symbol": "SYNTH_10",
      "underlying_symbol_name": "Synthetic 10 Index",
      "underlying_symbol_type": "stockindex",
      "market": "synthetic_index",
      "submarket": "random_index",
      "subgroup": "synthetics",
      "pip_size": "0.001",
      "exchange_is_open": 1,
      "is_trading_suspended": 0
    },
    {
      "underlying_symbol": "SYNTH_100",
      "underlying_symbol_name": "Synthetic 100 Index",
      "underlying_symbol_type": "stockindex",
      "market": "synthetic_index",
      "submarket": "random_index",
      "subgroup": "synthetics",
      "pip_size": "0.01",
      "exchange_is_open": 1,
      "is_trading_suspended": 0
    },
    {
      "underlying_symbol": "SYNTH_FX",
      "underlying_symbol_name": "Synthetic FX Pair",
      "underlying_symbol_type": "forex",
      "market": "forex",
      "submarket": "major_pairs",
      "subgroup": "none",
      "pip_size": "0.00001",
      "exchange_is_open": 0,
      "is_trading_suspended": 1
    }
  ]
}
